通稱,name,scientificName,chineseName,attribute,described,distribution
糯米條;六道木,Abelia chinensis,Abelia chinensis R. Br.var. ionandra (Hayata) Masam.,台灣糯米條,Endemic,"Low shrubs, 1–1.5m tall; bark of older branches longitudinally cracked, branchlets pubescent.Leaves ovate to linear-oblong or elliptic-globose, dentate to crenate, sometimes entire, 0.6–1.5(–2) cm long, 0.2–1(–1.3) cm broad, on branchlets with rapid elongation up to 3 cm long, 2.0 cm broad, base obtuse to cordate, apex acute to round, lower surface pale.Peduncles 1–4 together, subtended by a bract. Cymes lateral or terminal, in panicle-like clusters. Flowers sessile, on 1- or 2-flowered peduncles with bracteoles; bracteoles usually 4, whorled ; calyx tube linear-lanceolate, 3–4 mm long in flower, ca. 5 mm long in fruit, lobes obovate, 4–5 mm long in flower, 5–9 mm long in fruit; corolla tubular-campanulate, pink turning white in age, ca. 1 cm long; lobe subequal; stamens exserted; style exserted.Fruit linear-lanceolate, ca. 5 mm long, crowned with elongated calyx lobes. is characterized by the exserted stamens and style and leaves 2–5 cm long. Variety ionandra usually has leaves less than 2 cm long.",World:The typical variety occurs in southern China; variety  is endemic to Taiwan.Taiwan:In rocky places on Keelung Island and along the eastern coast below 1500m.
臺灣糯米條,Abelia chinensis var. ionandra,Abelia chinensis R. Br.var. ionandra (Hayata) Masam.,台灣糯米條,Endemic,"Low shrubs, 1–1.5m tall; bark of older branches longitudinally cracked, branchlets pubescent.Leaves ovate to linear-oblong or elliptic-globose, dentate to crenate, sometimes entire, 0.6–1.5(–2) cm long, 0.2–1(–1.3) cm broad, on branchlets with rapid elongation up to 3 cm long, 2.0 cm broad, base obtuse to cordate, apex acute to round, lower surface pale.Peduncles 1–4 together, subtended by a bract. Cymes lateral or terminal, in panicle-like clusters. Flowers sessile, on 1- or 2-flowered peduncles with bracteoles; bracteoles usually 4, whorled ; calyx tube linear-lanceolate, 3–4 mm long in flower, ca. 5 mm long in fruit, lobes obovate, 4–5 mm long in flower, 5–9 mm long in fruit; corolla tubular-campanulate, pink turning white in age, ca. 1 cm long; lobe subequal; stamens exserted; style exserted.Fruit linear-lanceolate, ca. 5 mm long, crowned with elongated calyx lobes. is characterized by the exserted stamens and style and leaves 2–5 cm long. Variety ionandra usually has leaves less than 2 cm long.",World:The typical variety occurs in southern China; variety  is endemic to Taiwan.Taiwan:In rocky places on Keelung Island and along the eastern coast below 1500m.
黃秋葵,Abelmoschus esculentus,,,,,
蘭嶼秋葵,Abelmoschus lanyunatus,,,,,
剛毛黃蜀葵,Abelmoschus manihot var. pungens,,,,,
香葵,Abelmoschus moschatus,Abelmoschus moschatus (L.) Medicus,香葵,Naturalized,"An annual erect herb; petioles, pedicels and leaves covered with stellate hairs, rarely glabrous.Leaves chartaceous, variable in size and shape, mostly orbicular in outline, 3–7-lobed or parted, the apex acuminate, the base cordate, the margin usually toothed, 15–25 cm long, 5–9-nerved at base; petioles as long as or longer than the leaves; stipules linear, hairy.Flowers solitary, axillary epicalyx-segments 7–9, linear, about 1.5 cm long, hairy; calyx stellate-tomentose, about 3 cm long; corolla large, yellow; petals obovate, slightly hairy, staminal tube glabrous; ovary hirsute, ovoid.Capsule ovoid or oblong, about 5–8 cm long, more or less hairy.","World:India, Malaysia to the Pacific Islands.Taiwan:In waste places and fallow fields."
臺灣冷杉,Abies kawakamii,Abies kawakamii (Hayata) Ito,台灣冷杉,Endemic,,
雞母珠;美麗相思子,Abrus precatorius,Abrus precatorius L.,雞母珠,,"A climbing shrub, much branched, the branches slender.	Leaves 5–8 cm long, deciduous; leaflets 20–40, membranaceous, rhomboid, 2–3 cm long.	Pseudoracemes many-Flowered, axillalry; corolla reddish or white.Pods ellipsoid, 2.5–4 cm long, containing 4–6 seeds. Seeds bright scarlet, with a black spot on one side.","World:	Pantropics;Taiwan:Taiwan, in dry and open places, including thickets secondary forest, windbreak, waste place or along the rivers on the central and southern part."
泡果莔;泡果?,Abutilon crispum,Abutilon crispum (L.) Medicus,泡果莔,Naturalized,"A suffrutescent herb, usually creeping. Stem pubscent.Leaves cordate, ca. 4.0–7.0 cm long, 3.0–6.0 cm wide; apex acuminate; base cordate; margin crenate to serrate; stellate on both surfaces; petioles sessile or near so, ca. 0.2-0.5 cm long; stipules linear.Flowers yellow, solitary and axillary; pedicels 2.0–4.0 cm long; calyx green, disc-shaped, densely pubescent, 5-lobed, segments ovate, ca. 0.3-0.4 cm long, apex acuminate; corolla ca. 1.0 cm across, petals 5, yellow, glabrous, obovate or broadly obovate, ca. 0.5 cm long; staminal tube glabrous; carpels about 15, densely pubescent.Capsules globular or pumpkin-form, ca. 1.0–2.0 cm across, composed of 10–15 pubesent carpels, without beaked at apex; persistent calyx much shorter than capsule; seeds many, dark brown, ca. 0.2 cm long, sparse bristle.","World:The species originally distributed around tropical and subtropical America, and now it is found from Australia, Vietnam, Mainland China (Hainan Prov.) and India.Taiwan:Only found in waste places or along roadside of central part of the island."
大葉莔麻,Abutilon grandifolium,Abutilon grandifolium (Will.) Sweet,大葉莔,Naturalized,,
毛莔,Abutilon hirtum,Abutilon hirtum (Lamk.) Sweet,毛莔,,,
疏花莔麻,Abutilon hulseanum,,,,,
冬葵子,Abutilon indicum,Abutilon indicum (L.) Sweet,冬葵子,,"An erect suffrutescent herb, ca. 1.0–2.5 m tall, branched, pubescent.Leaves ovate to orbicular, ca. 2.0–10 cm long, 3,0–11 cm wide; apex acute or acuminate; base cordate; margin entire or irregularly toothed; stellate on both surfaces; petioles 3.5–13 cm long, pubescent; stipules linear.Inflorescence solitary or paniculate, axillary or terminal; pedicels ca. 2.0–7.0 cm long, pubescent. Flowers yellow; calyx green, disc-shaped, pubescent, 5-lobed, segments broadly ovate or triangular, ca. 0.35-0.6 cm long, apex acute; corolla ca. 2.0–2.5 cm across, petals 5, yellow, glabrous or nearly, ca. 0.7-0.8 cm long; staminal tube stellate-hirsute; carpels 15–20, densely pubescent.Capsules compressed globular or millstone-like, ca. 1.2–2.5 cm across, composed 15–20 pubescent carpels, with beaked at apex; persistent calyx much shorter than capsule; seeds many, dark brown, ca. 0.3 cm long, almost glabrous or sometimes with sparse bristle.","World:Tropical and subtropical Asia, from India, Sri Lanka, Burma, China (Yunnan, Guizhou, Guangxi, Hainan, Guangdong, Fujiang), Thailand, Cambodia, Laos, Veitnam to Taiwan, and south to Indonesia.Taiwan:Common through whole island, especially in waste places or along roadside."
畿內冬葵子,Abutilon indicum var. guineense,Abutilon indicum (L.) Sweetvar. guineense (Schumach.) Feng,畿內冬葵子,,"An erect suffrutescent herb, ca. 0.5–1 m tall, branched, pubescent.Leaves orbicular to broadly ovate, ca. 4.5–11.5 cm long, 3.5–12 cm wide; apex acute or acuminate; base cordate; margin irregularly crenate, dentate or entire; tomentose and stellate hairy on both surfaces; petioles 3.0–10.5 cm long, pubescent; stipules linear.Inflorescence solitary or paniculate, axillary or terminal; pedicels ca. 2.5–7.0 cm long, pubescent. Flowers yellow; calyx green, disc-shaped, stellate, 5-lobed, segments broadly ovate or triangular, ca. 1.0–1.6 cm long, apex acute; corolla ca. 2.0–2.5 cm across, petals 5, yellow, glabrous or nearly, ca. 1.5 cm long; staminal tube glabrous; carpels 15–22, densely pubescent.Capsules compressed globular or millstone-like, ca. 1.5–2.5 cm across, composed 15–22 pubescent carpels, with beaked at apex; persistent calyx as long as capsule; seeds many, dark brown, ca. 0.2-0.4 cm long, sparse bristle.","World:Distributed in tropical and subtropical Asia, Africa, Australia area, mainly in south hemisphere. The taxon distributed in Guinea, Malaysia, Indonesia, Australia, tropical Africa and Taiwan.Taiwan:Found along seaside, sand places or sometimes waste places."
風鈴花,Abutilon striatum,Abutilon striatum Dicks. ex Lindl.,風鈴花,Naturalized,,
莔麻,Abutilon theophrasti,,,,,
藤相思樹,Acacia caesia,Acacia caesia (L.) Willd.,藤相思樹,,"A climbing shrub; branches and petioles angular, densely short reflexd prickled.Leaves bipinnate; pinnae 6–16; leaflets 30–60, linear-oblong, subcoriaceous, 4–5 mm long; glands round at the base of pinnae and square at the upper part of petiole.Flowers yellow, in panicled heads, 1–1.1 cm across.Pods straight, ovoid-cylindric, smooth, persistent bract, dehiscent, 6–10 cm long, 2 cm wide, containing 8–12 seeds.","World:Indo-Malaya;Taiwan:Taiwan, in secondary forests at low altitudes, rather scarce."
相思樹,Acacia confusa,Acacia confusa Merr.,相思樹,,"An evergreen tree, the trunk up to 1 m across.Phyllodia sessile, alternate, coriaceous, lanceolate, falcate, 8–10 cm long, attenuate at both ends, 3–5 parallel veined.Flowers on simple, terminal golden-yellow heads, 6–9 mm wide.Pods punctate, septate, acute ends, 5–10 cm long, 8 mm across, containing 7–8 seeds.","World:N. Philippines.Taiwan:Taiwan, throughout the island, very common in secondary forest and wastelands."
銀栲,Acacia dealbata,Acacia dealbata Link.,銀栲,Cultivated,"A tree, up to 12 m high; branchlets glabrous, angular.Leaves with 6–12 pinnae, each with 30–50 leaflets; petiole-glands a little lower at the middle portion of petiole; leaflets obliquely lanceolate, the main vein near to one side of margin, 0.8–1.3 cm long, 0.2-0.4 cm wide, the base truncate, nearly at right angle.Flowers in racemose globose-head, the filaments light pink.Pods flat, 5–10 cm long. 1.3–1.5 cm wide.","World:Iran to China.Taiwan:Taiwan, along river banks at low to medium altitudes, occasionally cultivated."
金合歡,Acacia farnesiana,Acacia farnesiana (L.) Willd.,金合歡,Naturalized,"An erect shrub, the branches zigzag with forking prickles, 2–4 m high, the stipular spines sharp.Leaves pinnate, 5–8 cm long; leaflets 10–20 pairs, linear-oblong, 4–7 mm long; glands on the upper part of petiole. Inflorescence in pedunculate axillary heads, 1–4 heads together, subglobose, 2.5–3 cm long;Flowers yellow, fragrant, 4–5 mm across; stamens numerous.Pods turgid, 5–7 cm long, 1–1.5 cm wide, straight or falcate, oblique-striate, acute apex. Seeds compressed, elliptic.","World:A native of tropical America, now pantropic.Taiwan:Taiwan, widely distributed in the southern part of the island."
屏東鐵莧,Acalypha akoensis,Acalypha akoensis Hayata,屏東鐵莧,Endemic,"A shrub; branches reddish, terete, subglabrous.Leaves membranaceous, ovate, 12–16 cm long, 8–11 cm broad, the apex cuspidate-acute, the base cuneate-cordate or rounded-cordate, the margins serrulate, sparingly pilose on both surfaces; petioles 6–9 cm long, densely pubescent; stipules lanceolate, 12 mm long, acuminate.Male spikes filiform, recurved, 16–20 cm long, villose; peduncles 1 cm long. Female spikes slender, 5–9 cm long, pubescent; peduncles 1 cm long; bracts ovate, 3.5 mm long, 5 mm broad, 10-dentate, pubescent outside; bracteoles minute; ovary 3-lobed, hirsute; styles about 2.5 mm long.",Taiwan:Endemic. In the central and southern parts at low altitudes.
臺灣鐵莧,Acalypha angatensis,Acalypha angatensis Blanco,台灣鐵莧,,"A shrub; branches hirsute.Leaves membranaceous, long-petiolate, rounded-ovate, 18–23 cm long, 13–15 cm broad, the apex cuspidate-acute, the base broadly rounded, the margins serrulate, rarely hirsute; petioles 8–10 cm long; stipules acuminate-ovate, 8 mm long.Female spikes axillary, solitary, slender, 7 cm long; peduncles 1 cm long; each flower subtended by a semi-orbicular, 10-dentate bract, about 5 mm long, 7 mm broad; sepals 3, ovate, ciliate; ovary globose, 3-lobed, about 0.7 mm long, hirsute; styles about 4 mm long.","World:The Philippines.Taiwan:Mainly in the central-southern part, in thickets at medium altitudes."
南美鐵莧,Acalypha aristata,Acalypha aristata Kunth,南美鐵莧,Naturalized,"Annual herbs, 30-50 cm tall, the stem erect, 2-3 mm wide, green flushed with purplish red, densely hispid with appressed, incurved hairs, somewhat woody at
base.Leaves alternate; blades rhomboid, ovate to broadly ovate, 4-7 cm long and 3-4 cm wide, acute to obtuse at apex, rounded to slightly cordate at base, pubescent above and below, hispid on veins, palmately 5-veined, the margins crenate-serrate; petioles 2-3 cm long, densely hispid with appressed, incurved hairs; stipules lanceolate, 1.5-3 mm long, hispid.Inflorescence spicate, axillary. Staminate spikes with peduncles up to 1 cm long, ellipsoidal, 5 mm long and 2 mm wide. Staminate flowers densely clustered, 5-8 at a node and subtended by a bract, the bract oblong, 0.5-0.8 mm long, hispid, with a long apical bristle up to 8 mm long and smaller bristles on margins, pedicels up to 0.6 mm long, hispidulous; petals lacking; calyx lobes 4, ovate, 0.3 mm long and wide, purplish red, hispidulous and tuberculate outside; stamens 8 in clusters, white, anthers elongated, 0.3 mm long, pendent, filaments 0.2 mm long. Pistillate spikes ellipsoidal to short cylindrical, 1-2.5 cm long, 1-1.3 cm wide, with a terminal bristlelike projection 5-15 mm long, the projection purplish red, hispidulous, bearing 3-5 nodes of staminate flowers at base and a terminal T-shaped abnomal pistllate flower. Pistillate flowers solitary, sessile, subtended by a foliaceous bract and usually 2-4 extra bractlets, the bracts ovate, 4-7 mm long, 2-3 mm wide, hispid with 5 bristlelike lobes 1.5-2 mm long, the bractlets linear, 1 mm long, hispid; petals lacking; calyx lobes 3, lanceolate, hispidulous, styles 3, elongated, 4-5 mm long, stigma red, divided into filiform segments 2 mm
long.Capsules ovoid, 3-lobed, 3 mm across, hispidulous, with persistent styles. Seeds 3, ellipsoidal, carunculate, 1.5mm long, 1 mm wide, gray with blackish brown spots, punctate on the surface.","World:Native from Mexico, the West Indies south to Panama, Venezuela, Peru and Brazil.Taiwan:In Hualien County. It is found on dry, sandy soils, along orchards, shrub borders,
unmanaged meadows, and in waste areas."
鐵莧菜;麻葉鐵莧菜,Acalypha australis,Acalypha australis L.,鐵莧菜,,"An annual herb up to 1 m high; stems erect, branched, hirsute or nearly glabrous.Leaves membranaceous, lanceolate to ovate-lanceolate, 2–6 cm long, 1–3 cm broad, the apex acuminate, the base acute or rounded, the margins obtusely serrate, sparsely pilose, 3-nerved at base; petioles 2–5 cm long. Spikes axillary, androgynous, short-pedunculate, 1–4 cm long.Male flowers at the top of the spikes, small, naked. Female flowers at the base of the spikes; bracts reniform, 1–1.5 cm long, acuminate; sepals ovate, ciliate; ovary pilose; styles 3 mm long.Capsules 3 mm across, pilose; seeds 1.5–2 mm long, smooth.","World:Ussuri, Korea, Japan, the Ryukyus, China and the Philippines.Taiwan:Throughout the whole island at low altitudes."
短序鐵莧菜;裂苞鐵莧菜,Acalypha brachystachya,Acalypha brachystachya Hornem.,短序鐵莧菜,,"A slender annual herb, about 30 cm high; stem sulcate, tomentose and mingled with long straight hairs.Leaves ovate, acuminate with obtuse tip, base slightly cordate or rounded, 2.8–4.5 cm long, 1.5–2.4 cm broad, margin serrate, teeth rounded, with long straight hairs along veins and veinlets at both surfaces; petioles tomentose and mingled with long straight hairs, 1–3.5 cm long.Spike axillary, shorter than bract: male flowers inserted at the upper portion, very small, ebracteate, sepals 4, yellowish brown when dry, valvate in bud; filament 8; female flowers inserted at the lower portion, bract deeply 3-fided, fid lanceolate, rounded at apex , with hairs and glandular hairs, sometimes the lateral lobes with one auricles at base; sepals laciniate at the apex.Fruit a capsule, 3-celled. Seeds 3 in each capsule, oval, brown, about 1.5 mm long, carunculate.","World:Tropical Africa, India, China and Java.Taiwan:Confined to the forest floor beside brooks in the southern area at elevation of 1120 m."
蘭嶼鐵莧,Acalypha caturus,Acalypha caturus Bl.,蘭嶼鐵莧,,"A small tree.Leaves chartaceous, broadly ovate to cordate, 8–13 cm long, 6–12 cm broad, the apex acuminate, the base cordate, truncate or rounded, the margins serrulate, densely pubescent in the nerve-axils beneath; petioles 8–10 cm long, hairy; stipules linear-lanceolate, 13 mm long. Inflorescences axillary, unisexual, rarely androgynous.Male spikes 8–20 cm long. Female spikes 5–6 cm long, solitary; bracts broadly reniform, 4–5 mm long, acute; bracteoles 2; sepals 3, ovate, pubescent; ovary 2-celled, pubescent; styles 2, 2–3 mm long.Capsules 3-lobed; seeds obliquely ovoid, about 1.5 mm long.","World:The Philippines, Celebes, Java, Sumatra and Borneo.Taiwan:Confined to Is. Lanyu."
紅花鐵莧,Acalypha hispida,,,,,
紅頭鐵莧,Acalypha hontauyuensis,Acalypha hontauyuensis Keng,紅頭鐵莧,Endemic,"A shrub; branches tomentose.Leaves thinly chartaceous, cordate-orbicular, 12–18 cm long, 12–16 cm broad, the apex caudate-acuminate, the base obliquely truncate-cordate, the margins crenate-serrate, the nerve-axils hirsute beneath; petioles slender, 8–20 cm long, tomentose.Female spikes axillary, solitary, 6–10 cm long; peduncles 0.5–2 cm long; bracts triangular, about 1 mm long, densely hirsute without. Female flowers with 3 sepals, ovate, about 3 mm long; styles 2.5–3 mm long.",Taiwan:Endemic to Is. Lanyu only.
印度鐵莧,Acalypha indica var. indica,,,,,
小葉鐵莧;熱帶鐵莧菜,Acalypha indica var. minima,Acalypha indica L.var. minima (Keng) Huang & Huang,小葉鐵莧,Endemic,"An annual herb, up to 30 cm high; stems woody near base, pilose above.Leaves subrhomboid-ovate, 1–1.5 cm long, 0.7–1.3 cm broad, the apex acute, the base cuneate, the margin crenate, both surfaces sparingly setose-villose.Spike 0.5–1 cm long; fruit bearing bracts triangular-ovate, cordate, 2–4 mm long, 5–8 mm broad, the margins dentate, setose-villose.Capsule 3-lobed, 2–3 mm long, short-pilose.",Taiwan:Endemic. This variety inhabits open seaside in the southern part.
尖尾鐵莧,Acalypha longi-acuminata,,,,,
恆春鐵莧,Acalypha matudai,Acalypha matudai Hayata,恆春鐵莧,Endemic,"Undershrub; branches red-purplish, more or less hirsute.Leaves mem¬branaceous, oblong-lanceolate, 5–8 cm long, 1.5–3 cm broad, the apex acuminate, apiculate, the base obtuse to rounded, the margins serrulate, both surfaces subglabrous; petioles 1–2 cm long, hirsute.Spikes androgynous, axillary, 3–4 cm long, erect. Male flowers at base of spike, 5–6 at each node; bracts minute, ovate; sepals 4, oblong. Female flowers solitary, each with a bract.Capsules 3-lobed, hirsute; seeds complanate-ovoid, about 1.5 mm long, 1 mm broad, smooth, the apex short-beaked.",Taiwan:Endemic. Confined to Hengchun Peninsula.
紅尾鐵莧,Acalypha reptans,Acalypha reptans Sw.,紅尾鐵莧,Cultivated,,
菱葉鐵莧,Acalypha siamensis,Acalypha siamensis Gagnep.,菱葉鐵莧,Cultivated,,
花蓮鐵莧,Acalypha suirenbiensis,Acalypha suirenbiensis Yamamoto,花蓮鐵莧,Endemic,"A subshrub; branchlets densely pubescent.Leaves chartaceous, ovate, 12–20 cm long, 8–15 cm broad, the apex caudate-acuminate, the base obtuse or truncate rounded, the margins subentire, the lower surface glabrescent, densely hirsute in the axils of secondary veins; petioles 8–15 cm long, tomentose.Female spikes very slender, axillary, solitary, 20–25 cm long; peduncles 4–5 cm. Female flowers very remotely arranged on the rachis, sessile, 1-bracteate, the bracts small, ovate, 1 mm long, densely hirsute on the external surface; sepals 3, ovate, l mm long, concave; styles 2–5 mm long, finely branched; ovary depressed-globose, 1.5 mm across, 1.4 mm long, pubescent.Capsules 3-lobed, 4 mm wide; seeds ovoid, 2 mm long, 1 mm wide.",Taiwan:Endemic. Known from Hualien along the eastern coast.
威氏鐵莧,Acalypha wilkesiana,,,,,
蕉蘭,Acampe rigida,Acampe rigida (Buch.-Ham ex J. E. Sm.) Hunt,蕉蘭,,"Stems stout, 1 m or more long, 1-2 cm in diam., rooting near base, roots thick and rigid.Leaves linear, 25-30 cm long, 4-5 cm wide, thick coriaceous, yellowish green, apex rounded and slightly oblique, base decurrent into sheath; sheaths tube like, embracing stem, 3 cm long.Racemes lateral from upper part of stem, subcorymbose; bracts scale-like, 3-4 mm long, 5-6 mm wide; pedicel and ovary 11-13 mm long. Flowers pale yellow with red transverse stripes, ca. 1.8 cm in diam.; dorsal sepals oblanceolate, 13-15 mm long, 7-8 mm wide, apex rounded; lateral sepals obovate, slightly oblique, 13-15 mm long, 7-9 mm wide, obscurely keeled outside; petals oblanceolate falcate, 12-13 mm long, 4-5 mm wide, apex obtuse, base contracted; lip fleshy, whitish above, yellowish below, 1 cm long, base saccate, blade 3-lobed, lateral lobes erect, broadly triangular, midlobe ovate or oblong, recurved at apex, thickened at base, disc pubescent, sac shallowly conic, pubescent inside; column 2 mm high; anther cap semispherical, 2 mm long; pollinia globose, 0.8 mm in diam.; stipe slender viscidium rhombic, 2-fid.Capsules nearly cylindrical, 5-6 cm long.","World:Southern China, eastern Himalaya, northern Assam, Thailand, Indochina, Sri Lanka and Malaysia.Taiwan:On exposed rocks and precipices along rivers at low elevations."
延齡罈花蘭,Acanthephippium pictum,Acanthephippium pictum Fukuy.,延齡罈花蘭,,"Terrestrial herb. Root about 3 mm in diameter. Pseudobulb fleshy, elongate clavate, about 13 cm long, 2.2-4 cm across.Leaves usually 3, stalk about 14 cm long, blade elliptic, about 20-50 cm long, 7-10 cm wide, lower leaf usually smaller, mainly 5-9-veins.Scape lateral from the new years growth, arising from the base of middle nodes of the pseudobulb, about 18 cm long. Inflorescence of raceme, flowers 3-5, dense, flowers whitish yellow and flushed tongue-shaped, about 1 cm long; column about 7 mm long; foot about 1.3 cm long, base adnated into a sac with lip and lateral sepals, pollinia 8, ellipsoid, in two groups of 4, two of these larger, and two smaller, yellow, with caudicle, no viscidium.Fruit held on long, erect stalks, ellipsoid, ridged.Chromosome number: 2n = 48.","World:The Ryukyus, Japan.Taiwan:Lanyu island"
一葉罈花蘭;中華壇花蘭,Acanthephippium striatum,Acanthephippium striatum Lindl.,一葉罈花蘭,,"Roots 3-4 mm in diam., densely hairy. Pseudobulbs elongate clavate, 6-15 cm long, fleshy, base 1-2 cm in diam., gradually tapering toward apex, narrowed into petiole, nodes 2-4, scales at nodes membranaceous.Leaves solitary, rarely 2, shortly petioled, oblong, 20-30 cm long, 7-10 cm wide, strongly plicate, mainly 5-nerved, apex acute, base decurrent; petiole articulated with pseudobulb. Scape 10-13 cm tall, base with many membranaceous scales; bracts ovate-oblong, 3 cm long; pedicel and ovary 3-3.6 cm long, glabrous.Flowers 4 or 5, crowded, with red stripes, tubular, 3.5-4.5 cm long; dorsal sepal elliptic, 2.3-2.5 cm long, 1.1-1.3 cm wide, obtuse; lateral sepals adnate to foot of column, triangular-falcate, 2.8-3.5 cm long, base 2.7 cm wide, oblique, apex acute, mentum with narrow tip; petals spatulate, 2-2.3 cm long, 1 cm wide, apex acute or obtuse, base narrowed; lip included in mentum, sagittate, 2.5 cm long, base long-clawed, apex 3-lobed, lateral lobes falcate, 1 cm long, central lobe triangular, with red spots or patches, disc with a yellow raised ridge between lateral lobes; column ca. 1 cm long, slightly curved, foot 1.8 cm long, often with red stripes and spots; anther white, 4 mm long, apex sharply pointed; pollinia clavate, 2-3 mm long, in 2 groups of 4, attached to a soft caudicle; rostellum exserted beyond stigma.Capsules erect, 5-6 cm long.Chromosome number: A somatic chromosome count of 2n = 48 for a plant collected from Pinglin, Taipei Hsien, Taiwan.","World:The Himalaya, Indochina, southern China, Malaysia and Java.Taiwan:In broad-leaved forests below 1500 m throughout the island."
罈花蘭,Acanthephippium sylhetense,Acanthephippium sylhetense Lindl.,台灣罈花蘭,,"Pseudobulbs elongate ovoid to clavate, 7-15 cm long, 2.5-4 cm thick at base, tapering upwards, nodes 2-3, enclosed by triangular membranaceous scales.Leaves (2-)3 or 4, oblong, 30-40 cm long, 8-10 cm wide, mainly 9-nerved, apex acuminate, base decurrent into short petiole. Scape arising with new growth, 15-20 cm long, with 3 or 4 lanceolate scales below; bracts ovate or oblong, concave, 2.5-3 cm long, embracing pedicel; pedicel and ovary 4 cm long.Flowers 3-5, yellowish white, 4-4, 5 cm long; sepals with minute purple spots near inside apex, cohering into a tube, dorsal one elliptic, 3 cm long, 1.5 cm wide, apex rounded, lateral ones falcate-oblong, 4 cm long, 2 cm wide, mentum 2.5 cm long; petals spatulate, 2.5 cm long, apex obtuse, base strongly contracted; lip adnate to foot of column, long clawed, claw elongate rectangular, 2.2 cm long, blade 3-lobed, lateral lobes oblong, erect, central lobe ligulate, fleshy, obtuse at apex, disc with 3-5 ridges near base; column 1.3 cm long, foot 1.8 cm long.Chromosome number: A somatic chromosome count of 2n = 48 for a plant collected from Wulai, Taipei Hsien, Taiwan.","World:The Ryukyus, the Philippines, Thailand and the Himalaya.Taiwan:In forests at low elevations in mountainous regions and on Lanyu Is."
刺五加,Acanthopanax senticosus,,,,,
刺苞果,Acanthospermum australe,,,,,
廈門老鼠?,Acanthus xiamenensis,,,,,
